{
  "$schema":"https://json-schema.org/draft/2020-12/schema","type":"object","required":["part_id","condition","nodes","relations"],
  "properties":{"part_id":{"pattern":"^R02_P0[2456]$"},"condition":{"enum":["TARGET","A0","A1","A2"]},"nodes":{"type":"array","minItems":1,"items":{"type":"object","required":["node_id","role","node_type","cad_feature_refs"],"properties":{"node_id":{"type":"string"},"role":{"type":"string"},"node_type":{"enum":["functional_body","structural_member","joint_region","open_space","interface_region"]},"cad_feature_refs":{"type":"array","items":{"type":"string"}}},"additionalProperties":false}},"relations":{"type":"array","items":{"type":"object","required":["source","relation","target"],"properties":{"source":{"type":"string"},"relation":{"enum":["connected_to","branches_into","parallel_to","attached_at_end","attached_on_side","separated_by_gap","symmetric_with","encloses","surrounds"]},"target":{"type":"string"}},"additionalProperties":false}}},"additionalProperties":false
}
