{
  "part_id": "R02_P05",
  "condition": "A2",
  "nodes": [
    {
      "node_id": "n0",
      "role": "central_wrist_carrier",
      "node_type": "functional_body",
      "cad_feature_refs": [
        "F00"
      ]
    },
    {
      "node_id": "n1",
      "role": "left_curved_prong",
      "node_type": "structural_member",
      "cad_feature_refs": [
        "F00"
      ]
    },
    {
      "node_id": "n2",
      "role": "right_curved_prong",
      "node_type": "structural_member",
      "cad_feature_refs": [
        "F00"
      ]
    },
    {
      "node_id": "n3",
      "role": "fork_gap",
      "node_type": "open_space",
      "cad_feature_refs": [
        "F00"
      ]
    },
    {
      "node_id": "n4",
      "role": "terminal_notch_slot",
      "node_type": "open_space",
      "cad_feature_refs": [
        "F01"
      ]
    },
    {
      "node_id": "n5",
      "role": "roll_flange",
      "node_type": "joint_region",
      "cad_feature_refs": [
        "F02"
      ]
    }
  ],
  "relations": [
    {
      "source": "n0",
      "relation": "branches_into",
      "target": "n1"
    },
    {
      "source": "n0",
      "relation": "branches_into",
      "target": "n2"
    },
    {
      "source": "n1",
      "relation": "symmetric_with",
      "target": "n2"
    },
    {
      "source": "n1",
      "relation": "separated_by_gap",
      "target": "n2"
    },
    {
      "source": "n3",
      "relation": "separated_by_gap",
      "target": "n1"
    },
    {
      "source": "n3",
      "relation": "separated_by_gap",
      "target": "n2"
    },
    {
      "source": "n4",
      "relation": "encloses",
      "target": "n1"
    },
    {
      "source": "n5",
      "relation": "attached_on_side",
      "target": "n0"
    }
  ]
}
